{
  "$schema": "https://json-schema.org/draft/2020-12/schema",
  "$id": "https://datadog.github.io/terraform-provider-datadog/contracts/run-report.schema.json",
  "title": "tfgen run report",
  "description": "The structured result tfgen generate writes to --report. CI asserts against it, so the shape is a contract: additionalProperties is false throughout, and a new field must be added here in the same change that emits it.",
  "type": "object",
  "additionalProperties": false,
  "required": [
    "run_id",
    "generator_version",
    "spec_hash",
    "started_at",
    "finished_at",
    "artifacts"
  ],
  "properties": {
    "run_id": {
      "type": "string",
      "description": "Unique identifier for this generation run."
    },
    "generator_version": {
      "type": "string",
      "description": "tfgen build version, or \"dev\" for a local build."
    },
    "spec_hash": {
      "type": "string",
      "description": "Lowercase hex SHA-256 of the OpenAPI source, identifying exactly which description produced this run."
    },
    "started_at": {
      "type": "string",
      "format": "date-time"
    },
    "finished_at": {
      "type": "string",
      "format": "date-time"
    },
    "artifacts": {
      "type": [
        "array",
        "null"
      ],
      "description": "One entry per generated, retired, or failed provider artifact. Null is permitted because the field carries no omitempty and a run that produced no artifacts marshals its nil slice to null; consumers must treat null and [] alike. Accepting it here rather than emitting [] keeps existing report bytes unchanged.",
      "items": {
        "$ref": "#/$defs/artifactEntry"
      }
    },
    "skipped_operations": {
      "type": "array",
      "description": "Operations that produced no artifact, listed for visibility rather than as failures.",
      "items": {
        "$ref": "#/$defs/skippedOperation"
      }
    },
    "summary": {
      "$ref": "#/$defs/runSummary"
    },
    "cassettes": {
      "type": "array",
      "description": "One entry per example-backed cassette target. Absent unless cassette generation was requested, so a run without it is byte-identical to one from before the feature existed.",
      "items": {
        "$ref": "#/$defs/cassetteResult"
      }
    },
    "cassette_summary": {
      "$ref": "#/$defs/cassetteSummary"
    }
  },
  "$defs": {
    "diagnostic": {
      "type": "object",
      "additionalProperties": false,
      "required": [
        "severity",
        "message"
      ],
      "description": "One error, warning, or informational message. A cassette diagnostic names source anchors only and never carries an example value, which may be credential material.",
      "properties": {
        "severity": {
          "type": "string",
          "enum": [
            "error",
            "warning",
            "info"
          ]
        },
        "message": {
          "type": "string"
        },
        "location": {
          "type": "string",
          "description": "Optional source-side anchor, e.g. spec:/api/v2/widgets.post.requestBody.content.application/json.example"
        },
        "category": {
          "type": "string",
          "enum": [
            "eligibility",
            "selection",
            "materialization",
            "validation",
            "render",
            "write"
          ],
          "description": "Optional stage that produced this diagnostic. Set by the cassette chain; the artifact pipeline's diagnostics carry none."
        }
      }
    },
    "artifactKind": {
      "type": "string",
      "enum": [
        "resource",
        "data_source"
      ],
      "description": "Terraform namespace the artifact belongs to."
    },
    "artifactEntry": {
      "type": "object",
      "additionalProperties": false,
      "required": [
        "name",
        "kind",
        "status",
        "path"
      ],
      "properties": {
        "name": {
          "type": "string",
          "description": "Terraform artifact name without the datadog_ prefix."
        },
        "kind": {
          "$ref": "#/$defs/artifactKind"
        },
        "status": {
          "type": "string",
          "enum": [
            "created",
            "updated",
            "unchanged",
            "skipped",
            "failed",
            "retired",
            "retire_blocked",
            "registration_retired"
          ]
        },
        "path": {
          "type": "string",
          "description": "File the entry concerns. Empty on a registration_retired entry, whose generated files are already gone."
        },
        "diagnostics": {
          "type": "array",
          "items": {
            "$ref": "#/$defs/diagnostic"
          }
        },
        "orphaned_hooks": {
          "type": "array",
          "description": "Hook functions declared but no longer referenced.",
          "items": {
            "type": "string"
          }
        },
        "constructor": {
          "type": "string",
          "description": "Set only on a registration_retired entry: the removed registration identifier, authoritative because the artifact name cannot be recovered once the files are gone."
        },
        "tag": {
          "type": "string",
          "description": "OpenAPI tag owning the artifact registry. Absent for retired artifacts whose declaration no longer exists."
        }
      }
    },
    "skippedOperation": {
      "type": "object",
      "additionalProperties": false,
      "required": [
        "operation_id",
        "path",
        "method",
        "reason"
      ],
      "properties": {
        "operation_id": {
          "type": "string"
        },
        "path": {
          "type": "string"
        },
        "method": {
          "type": "string"
        },
        "reason": {
          "type": "string",
          "enum": [
            "tracking_field_absent"
          ]
        }
      }
    },
    "runSummary": {
      "type": "object",
      "additionalProperties": false,
      "description": "Convenience counts for CI assertions, one per artifact status. Unchanged by cassette generation, which reports through cassette_summary instead.",
      "required": [
        "created",
        "updated",
        "unchanged",
        "skipped",
        "failed",
        "retired",
        "retire_blocked",
        "registration_retired"
      ],
      "properties": {
        "created": {
          "type": "integer",
          "minimum": 0
        },
        "updated": {
          "type": "integer",
          "minimum": 0
        },
        "unchanged": {
          "type": "integer",
          "minimum": 0
        },
        "skipped": {
          "type": "integer",
          "minimum": 0
        },
        "failed": {
          "type": "integer",
          "minimum": 0
        },
        "retired": {
          "type": "integer",
          "minimum": 0
        },
        "retire_blocked": {
          "type": "integer",
          "minimum": 0
        },
        "registration_retired": {
          "type": "integer",
          "minimum": 0
        }
      }
    },
    "cassetteResult": {
      "type": "object",
      "additionalProperties": false,
      "required": [
        "name",
        "kind",
        "test_name",
        "status",
        "write_action"
      ],
      "properties": {
        "name": {
          "type": "string"
        },
        "kind": {
          "$ref": "#/$defs/artifactKind"
        },
        "test_name": {
          "type": "string",
          "description": "Generated Go test function, which doubles as the cassette basename because the replay harness derives the cassette from t.Name()."
        },
        "status": {
          "type": "string",
          "enum": [
            "generated",
            "ineligible"
          ],
          "description": "generated: the test was written. ineligible: the description could not describe a whole lifecycle, and nothing was written. There is no preserved outcome: the generator writes only its own test, and emit refuses a file it does not own."
        },
        "write_action": {
          "type": "string",
          "enum": [
            "none",
            "created",
            "unchanged",
            "updated"
          ],
          "description": "What happened to the generated test file, reported apart from status so an eligible target that produced no change is distinguishable from one that rewrote its test. Mirrors the artifactEntry status vocabulary. No action describes replacing a recording: the cassette is recorded by running the test, never written by the generator."
        },
        "test_path": {
          "type": "string"
        },
        "selected_example": {
          "type": "string",
          "description": "Resolved scenario name: an explicit selection, \"default\", a lexical fallback, or \"single\" when the values came from singular example fields."
        },
        "diagnostics": {
          "type": "array",
          "items": {
            "$ref": "#/$defs/diagnostic"
          }
        }
      }
    },
    "cassetteSummary": {
      "type": "object",
      "additionalProperties": false,
      "description": "Counts per cassette status. Separate from runSummary so cassette generation cannot change the artifact tallies CI already asserts on.",
      "required": [
        "generated",
        "ineligible"
      ],
      "properties": {
        "generated": {
          "type": "integer",
          "minimum": 0
        },
        "ineligible": {
          "type": "integer",
          "minimum": 0
        }
      }
    }
  }
}
