{
  "run_id": "b83d2151-4d70-4610-ac37-2ceb9f5bc802",
  "generator_version": "dev",
  "spec_hash": "ff71272257daca0c5e7c9f64163d8b5dab2622b121a9748ec6df5e91eb5c976c",
  "started_at": "2026-09-16T13:44:10.904882899Z",
  "finished_at": "2026-09-16T13:44:13.441113341Z",
  "artifacts": [
    {
      "name": "integration_snowflake_account",
      "kind": "resource",
      "status": "created",
      "path": "../datadog/fwprovider/resource_datadog_integration_snowflake_account.go",
      "diagnostics": [
        {
          "severity": "info",
          "message": "resource schema merge: reconciled a cosmetic difference between the create/update/read bodies at \"data.attributes.authentication.snowflake_integration_account_private_key_auth\" — favoring the read response for name/description, unioning enum members, OR-ing sensitive"
        },
        {
          "severity": "info",
          "message": "resource schema merge: reconciled a cosmetic difference between the create/update/read bodies at \"data.attributes.authentication\" — favoring the read response for name/description, unioning enum members, OR-ing sensitive"
        },
        {
          "severity": "info",
          "message": "resource schema merge: reconciled a cosmetic difference between the create/update/read bodies at \"data.attributes.dataflows.snowflake-account-usage-metrics.enabled\" — favoring the read response for name/description, unioning enum members, OR-ing sensitive"
        },
        {
          "severity": "info",
          "message": "resource schema merge: reconciled a cosmetic difference between the create/update/read bodies at \"data.attributes.dataflows.snowflake-account-usage-metrics.settings.account_usage_metrics_aggregate_last_24h\" — favoring the read response for name/description, unioning enum members, OR-ing sensitive"
        },
        {
          "severity": "info",
          "message": "resource schema merge: reconciled a cosmetic difference between the create/update/read bodies at \"data.attributes.dataflows.snowflake-account-usage-metrics.settings\" — favoring the read response for name/description, unioning enum members, OR-ing sensitive"
        },
        {
          "severity": "info",
          "message": "resource schema merge: reconciled a cosmetic difference between the create/update/read bodies at \"data.attributes.dataflows.snowflake-account-usage-metrics\" — favoring the read response for name/description, unioning enum members, OR-ing sensitive"
        },
        {
          "severity": "info",
          "message": "resource schema merge: reconciled a cosmetic difference between the create/update/read bodies at \"data.attributes.dataflows.snowflake-cloud-cost-metrics.enabled\" — favoring the read response for name/description, unioning enum members, OR-ing sensitive"
        },
        {
          "severity": "info",
          "message": "resource schema merge: reconciled a cosmetic difference between the create/update/read bodies at \"data.attributes.dataflows.snowflake-cloud-cost-metrics.settings.query_tags\" — favoring the read response for name/description, unioning enum members, OR-ing sensitive"
        },
        {
          "severity": "info",
          "message": "resource schema merge: reconciled a cosmetic difference between the create/update/read bodies at \"data.attributes.dataflows.snowflake-cloud-cost-metrics.settings\" — favoring the read response for name/description, unioning enum members, OR-ing sensitive"
        },
        {
          "severity": "info",
          "message": "resource schema merge: reconciled a cosmetic difference between the create/update/read bodies at \"data.attributes.dataflows.snowflake-cloud-cost-metrics\" — favoring the read response for name/description, unioning enum members, OR-ing sensitive"
        },
        {
          "severity": "info",
          "message": "resource schema merge: reconciled a cosmetic difference between the create/update/read bodies at \"data.attributes.dataflows.snowflake-data-observability-quality-monitoring.enabled\" — favoring the read response for name/description, unioning enum members, OR-ing sensitive"
        },
        {
          "severity": "info",
          "message": "resource schema merge: reconciled a cosmetic difference between the create/update/read bodies at \"data.attributes.dataflows.snowflake-data-observability-quality-monitoring.settings.do_table_crawler_cron\" — favoring the read response for name/description, unioning enum members, OR-ing sensitive"
        },
        {
          "severity": "info",
          "message": "resource schema merge: reconciled a cosmetic difference between the create/update/read bodies at \"data.attributes.dataflows.snowflake-data-observability-quality-monitoring.settings.sync_snowflake_system_database\" — favoring the read response for name/description, unioning enum members, OR-ing sensitive"
        },
        {
          "severity": "info",
          "message": "resource schema merge: reconciled a cosmetic difference between the create/update/read bodies at \"data.attributes.dataflows.snowflake-data-observability-quality-monitoring.settings\" — favoring the read response for name/description, unioning enum members, OR-ing sensitive"
        },
        {
          "severity": "info",
          "message": "resource schema merge: reconciled a cosmetic difference between the create/update/read bodies at \"data.attributes.dataflows.snowflake-data-observability-quality-monitoring\" — favoring the read response for name/description, unioning enum members, OR-ing sensitive"
        },
        {
          "severity": "info",
          "message": "resource schema merge: reconciled a cosmetic difference between the create/update/read bodies at \"data.attributes.dataflows.snowflake-event-table-logs.enabled\" — favoring the read response for name/description, unioning enum members, OR-ing sensitive"
        },
        {
          "severity": "info",
          "message": "resource schema merge: reconciled a cosmetic difference between the create/update/read bodies at \"data.attributes.dataflows.snowflake-event-table-logs.settings.event_table_events_enabled\" — favoring the read response for name/description, unioning enum members, OR-ing sensitive"
        },
        {
          "severity": "info",
          "message": "resource schema merge: reconciled a cosmetic difference between the create/update/read bodies at \"data.attributes.dataflows.snowflake-event-table-logs.settings.event_table_logs_enabled\" — favoring the read response for name/description, unioning enum members, OR-ing sensitive"
        },
        {
          "severity": "info",
          "message": "resource schema merge: reconciled a cosmetic difference between the create/update/read bodies at \"data.attributes.dataflows.snowflake-event-table-logs.settings.event_table_logs_interval_min\" — favoring the read response for name/description, unioning enum members, OR-ing sensitive"
        },
        {
          "severity": "info",
          "message": "resource schema merge: reconciled a cosmetic difference between the create/update/read bodies at \"data.attributes.dataflows.snowflake-event-table-logs.settings.event_table_span_events_enabled\" — favoring the read response for name/description, unioning enum members, OR-ing sensitive"
        },
        {
          "severity": "info",
          "message": "resource schema merge: reconciled a cosmetic difference between the create/update/read bodies at \"data.attributes.dataflows.snowflake-event-table-logs.settings.event_table_spans_enabled\" — favoring the read response for name/description, unioning enum members, OR-ing sensitive"
        },
        {
          "severity": "info",
          "message": "resource schema merge: reconciled a cosmetic difference between the create/update/read bodies at \"data.attributes.dataflows.snowflake-event-table-logs.settings\" — favoring the read response for name/description, unioning enum members, OR-ing sensitive"
        },
        {
          "severity": "info",
          "message": "resource schema merge: reconciled a cosmetic difference between the create/update/read bodies at \"data.attributes.dataflows.snowflake-event-table-logs\" — favoring the read response for name/description, unioning enum members, OR-ing sensitive"
        },
        {
          "severity": "info",
          "message": "resource schema merge: reconciled a cosmetic difference between the create/update/read bodies at \"data.attributes.dataflows.snowflake-organization-usage-metrics.enabled\" — favoring the read response for name/description, unioning enum members, OR-ing sensitive"
        },
        {
          "severity": "info",
          "message": "resource schema merge: reconciled a cosmetic difference between the create/update/read bodies at \"data.attributes.dataflows.snowflake-organization-usage-metrics.settings.organization_usage_metrics_aggregate_last_24h\" — favoring the read response for name/description, unioning enum members, OR-ing sensitive"
        },
        {
          "severity": "info",
          "message": "resource schema merge: reconciled a cosmetic difference between the create/update/read bodies at \"data.attributes.dataflows.snowflake-organization-usage-metrics.settings\" — favoring the read response for name/description, unioning enum members, OR-ing sensitive"
        },
        {
          "severity": "info",
          "message": "resource schema merge: reconciled a cosmetic difference between the create/update/read bodies at \"data.attributes.dataflows.snowflake-organization-usage-metrics\" — favoring the read response for name/description, unioning enum members, OR-ing sensitive"
        },
        {
          "severity": "info",